{"$schema":"https://json-schema.org/draft/2020-12/schema","$id":"job.schema.json","title":"Legacy-compatible Recreation Job","type":"object","additionalProperties":true,"required":["job_id","global_master","shots"],"properties":{"job_id":{"type":"string"},"mode":{"type":"string"},"references":{"type":"object"},"global_master":{"type":"object"},"shots":{"type":"array","minItems":1,"items":{"type":"object","required":["id","source","semantic_function","presence_map","creative_delta"],"properties":{"id":{"type":"string"},"source":{"type":"string"},"semantic_function":{"type":"string"},"presence_map":{"type":"object","additionalProperties":{"type":"boolean"}},"creative_delta":{"type":"array","minItems":2,"items":{"type":"string"}}}}}}}
