{
  "job_id": "bracelet_regression",
  "mode": "RECREATED_SHOT",
  "references": {
    "product_reference": "references/PRODUCT_REFERENCE.png",
    "clothing_reference": "references/CLOTHING_REFERENCE.png"
  },
  "global_master": {
    "hand_master": {
      "authorized_hand_count": 1,
      "description": "same elegant fair-skinned female hand identity when HAND=YES; long nude glossy manicure; realistic anatomy"
    },
    "product_master": {
      "description": "pastel floral gemstone bracelet from PRODUCT_REFERENCE: green jade/moss-like beads, pale pink translucent beads, clear faceted crystal, milky white beads, gold filigree spacers, white flower ornament and dangling white-flower charm; exact reference identity should be preserved"
    },
    "clothing_master": {
      "description": "sheer ivory/cream lace sleeve from CLOTHING_REFERENCE; same material, tone, translucency and cuff character whenever CLOTHING=YES"
    },
    "environment_master": {
      "temple_description": "recreate the architecture shot as a visibly different but coherent traditional East Asian temple/courtyard view; preserve architecture-only semantic function; change camera/composition, lighting and foreground/background organization"
    }
  },
  "shots": [
    {
      "id": "RECREATED_01",
      "source": "source/SOURCE_01.png",
      "semantic_function": "single manicured hand holds up a bracelet for a close product reveal",
      "presence_map": {
        "hand": true,
        "product": true,
        "clothing": false,
        "temple": false
      },
      "mandatory_replacements": [
        "replace source bracelet with PRODUCT_MASTER",
        "remove all source text/branding"
      ],
      "preserve": [
        "one-hand product-hold interaction",
        "realistic fingers and grip"
      ],
      "creative_delta": [
        "new non-temple environment",
        "new camera/composition",
        "new lighting design"
      ]
    },
    {
      "id": "RECREATED_02",
      "source": "source/SOURCE_02.png",
      "semantic_function": "architecture-only establishing shot used as a luck/atmosphere beat; no person and no jewelry product",
      "presence_map": {
        "hand": false,
        "product": false,
        "clothing": false,
        "temple": true
      },
      "mandatory_replacements": [
        "remove source text",
        "recreate the architecture rather than copying the exact source view"
      ],
      "preserve": [
        "architecture-only shot function",
        "vertical establishing-shot readability"
      ],
      "creative_delta": [
        "different temple/courtyard viewpoint",
        "different composition/foreground structure",
        "different light/weather state"
      ]
    },
    {
      "id": "RECREATED_03",
      "source": "source/SOURCE_03.png",
      "semantic_function": "close wrist-worn bracelet lifestyle shot",
      "presence_map": {
        "hand": true,
        "product": true,
        "clothing": true,
        "temple": false
      },
      "mandatory_replacements": [
        "replace source bracelet with PRODUCT_MASTER",
        "replace red knitted sleeve with CLOTHING_MASTER",
        "remove source branding/text"
      ],
      "preserve": [
        "single wrist/hand lifestyle-display function",
        "physically plausible bracelet fit"
      ],
      "creative_delta": [
        "new non-temple background",
        "new camera angle/composition",
        "new lighting design"
      ]
    }
  ]
}